{"id":"ART-0231","canonical_name":"Linux network namespace","aliases":["netns","CLONE_NEWNET networking isolation"],"kind":"interface","parent_family":"Linux namespaces","manufacturer_or_body":["Linux kernel community"],"chronology":{"first_operational":{"value":"2008","precision":"year","certainty":"confirmed","source_ids":["SRC-0246"],"notes":"CLONE_NEWNET documented since Linux 2.6.24; implementation matured through later 2.6 releases. The separately recovered 2007 core merge chronology is an integration/substrate clock and does not move this operational boundary back into 2007."}},"networks_or_families":["Linux networking","containers"],"roles":["isolate network devices and protocol stacks","isolate routing/firewall/socket/port state","provide independent proc/sys networking views","compose with veth and higher-level routing domains"],"stack_position":["cross-layer","operations"],"software":{"operating_system":"Linux","programs":["ip netns","unshare","setns/clone namespace APIs"],"languages":["C"],"version_or_revision":"CLONE_NEWNET lineage"},"research_state":"substantial","certainty":"confirmed","open_questions":["Recover a full one-to-one Torvalds-tree SHA concordance for every numbered 01/16..17/16 core-series patch; the series identity/order, contemporary status and selected exact anchors are already recovered.","Recover protocol-family completion chronology beyond the 2.6.24 core staging where it materially changes operational claims."],"sources":[{"source_id":"SRC-0245","supports":["current isolation semantics"],"locator":"network_namespaces(7)","quotation_checked":false,"notes":null},{"source_id":"SRC-0246","supports":["2.6.24 introduction chronology and incomplete early implementation"],"locator":"CLONE_NEWNET documentation discussion","quotation_checked":false,"notes":null},{"source_id":"SRC-0269","supports":["contemporary veth intended-use/composition relationship with network namespaces"],"locator":"initial veth commit message","quotation_checked":true,"notes":"The veth commit supports functional composition, not a descent or causal lineage claim."},{"source_id":"SRC-0271","supports":["September 2007 00/16 core-series scope and ordering"],"locator":"00/16 series cover letter and thread","quotation_checked":true,"notes":"The series was intentionally scoped to the core network stack; full protocol conversion was not claimed."},{"source_id":"SRC-0272","supports":["contemporary staged and partial merge status"],"locator":"opening paragraphs of Network Namespace status","quotation_checked":true,"notes":"Core merge and full multiple-instance readiness are distinct claims."},{"source_id":"SRC-0273","supports":["exact mainline basic-infrastructure anchor","struct net and pernet lifecycle infrastructure"],"locator":"commit message + include/net/net_namespace.h + net/core/net_namespace.c","quotation_checked":true,"notes":"Core substrate, not full-stack completion."},{"source_id":"SRC-0274","supports":["separate clone/unshare creation path","CLONE_NEWNET and CONFIG_NET_NS"],"locator":"commit message + sched.h/fork.c/nsproxy.c/net/Kconfig/net_namespace.c","quotation_checked":true,"notes":"Posted separately after the 00/16 core series."},{"source_id":"SRC-0275","supports":["Netlink incremental-conversion boundary"],"locator":"12/16 opening explanation","quotation_checked":true,"notes":"Existing Netlink protocols remained init-namespace-only and returned -ECONNREFUSED elsewhere until converted."},{"source_id":"SRC-0276","supports":["network-device movement component","NETIF_F_NETNS_LOCAL behavior"],"locator":"commit message + loopback/netdevice/dev.c diff","quotation_checked":true,"notes":"Component/interface evidence, not deployment evidence."},{"source_id":"SRC-0286","supports":["2008 PID-selected userspace device move into a target network namespace"],"locator":"iproute2 IFLA_NET_NS_PID commit","quotation_checked":true,"notes":"Chronological userspace interface evidence; not kernel merge chronology."},{"source_id":"SRC-0287","supports":["2011 named/processless ip netns userspace administration model"],"locator":"processless network namespace support commit","quotation_checked":true,"notes":"Userspace administration semantics, not a kernel-subsystem completion claim."}],"related_artifacts":[{"id":"ART-0232","relation":"can-contain","notes":"VRFs can exist inside network namespaces; the isolation scopes differ."},{"id":"ART-0249","relation":"composes-with","notes":"The initial veth commit names network-namespace communication as a main use and anticipates peer creation in a separate namespace; no lineage edge is asserted."},{"id":"ART-0250","relation":"administered-by","notes":"iproute2 v3.0.0 is the first recovered tagged release snapshot containing the named/processless ip netns command family; functional userspace administration relation only."}],"notes":"Network namespace is broader stack isolation, not a version of policy routing or VRF. Exact veth mainline provenance is separately recorded as ART-0249. The 2007 core merge is now documented as staged integration: a 00/16 core series plus safety follow-up, followed by a separate CLONE_NEWNET clone/unshare creation patch; explicit init-namespace fences show the core merge was not a complete protocol-stack conversion. Named/processless ip netns userspace introduction and the first tagged release snapshot are separately recorded as ART-0250; that userspace clock is not kernel completion, first public distribution or deployment.","last_reviewed":"2026-09-05"}
