{"id":"ART-0250","canonical_name":"iproute2 `ip netns` named network-namespace command family","aliases":["ip netns","processless network namespace support","named network namespaces in iproute2"],"kind":"software","parent_family":"iproute2","manufacturer_or_body":["iproute2 project","Eric W. Biederman"],"chronology":{"first_operational":{"value":"2011-10-10","precision":"day","certainty":"confirmed","source_ids":["SRC-0287","SRC-0288"],"notes":"First tagged iproute2 release snapshot containing the named/processless `ip netns` command family is v3.0.0. Exact upstream introduction commit is 2011-07-13."}},"networks_or_families":["Linux networking","Linux network namespaces","iproute2"],"roles":["create and delete persistent named network namespace handles","list and monitor named network namespaces","execute ordinary programs inside a selected network namespace","move network devices into namespaces selected by name or earlier by PID"],"stack_position":["operations","software-api"],"software":{"operating_system":"Linux","programs":["ip netns","ip link"],"languages":["C"],"version_or_revision":"introduced by 0dc34c7713bb7055378fe5cbc720d63d0db572a1; first tagged release snapshot v3.0.0"},"research_state":"substantial","certainty":"confirmed","open_questions":["Recover a contemporary v3.0.0 release announcement or original distribution artifact if the stronger first-public-tarball claim is required.","The companion core-series research for ART-0231 recovers the 2007 series identity/order, contemporary partial-merge status and selected exact mainline anchors. A full numbered-patch SHA concordance and later protocol-family completion where needed for operational claims remain separate kernel-history questions."],"sources":[{"source_id":"SRC-0286","supports":["earlier PID-selected ip link netns administration interface"],"locator":"commit message + iplink/doc/manpage diff","quotation_checked":true,"notes":"Chronological predecessor only; no causal lineage edge asserted."},{"source_id":"SRC-0287","supports":["exact named/processless ip netns upstream introduction","command repertoire","/var/run/netns persistence model","/etc/netns configuration model","ip netns exec environment behavior"],"locator":"commit message + ip/ip.c + new ip/ipnetns.c","quotation_checked":true,"notes":null},{"source_id":"SRC-0288","supports":["first tagged-release/source-snapshot boundary at v3.0.0","absence of ipnetns.c in immediately preceding v2.6.39 tagged tree"],"locator":"v2.6.39 and v3.0.0 tagged trees + commit ancestry","quotation_checked":true,"notes":"Release-content boundary, not first distribution/deployment."}],"related_artifacts":[{"id":"ART-0231","relation":"administers","notes":"Userspace command family for creating, naming, entering, monitoring and configuring Linux network namespaces; functional relationship, not descent lineage."}],"notes":"The 2008 PID-based `ip link ... netns PID` interface predates the 2011 named/processless command family. Chronology alone is not encoded as causal lineage. v3.0.0 is confirmed as the first tagged release snapshot containing `ip netns`; original public tarball/announcement provenance remains a stronger separate question.","last_reviewed":"2026-09-05"}
